
*** Running vivado
    with args -log MIPSMulticiclo.vds -m64 -product Vivado -mode batch -messageDb vivado.pb -notrace -source MIPSMulticiclo.tcl


****** Vivado v2019.1.1 (64-bit)
  **** SW Build 2580384 on Sat Jun 29 08:12:21 MDT 2019
  **** IP Build 2579722 on Sat Jun 29 11:35:40 MDT 2019
    ** Copyright 1986-2019 Xilinx, Inc. All Rights Reserved.

source MIPSMulticiclo.tcl -notrace
Command: synth_design -top MIPSMulticiclo -part xc7a35tcpg236-1
Starting synth_design
Attempting to get a license for feature 'Synthesis' and/or device 'xc7a35t'
INFO: [Common 17-349] Got license for feature 'Synthesis' and/or device 'xc7a35t'
INFO: [Device 21-403] Loading part xc7a35tcpg236-1
INFO: Launching helper process for spawning children vivado processes
INFO: Helper process launched with PID 15432 
---------------------------------------------------------------------------------
Starting RTL Elaboration : Time (s): cpu = 00:00:05 ; elapsed = 00:00:05 . Memory (MB): peak = 822.215 ; gain = 176.840
---------------------------------------------------------------------------------
INFO: [Synth 8-638] synthesizing module 'MIPSMulticiclo' [C:/hlocal/ExamenPasado4/ficheros/MIPSMulticiclo.vhd:18]
INFO: [Synth 8-3491] module 'DCM_100MHz_10MHz' declared at 'C:/hlocal/ExamenPasado4/MIPSMulticiclo_R3yModoDepuracion.runs/synth_1/.Xil/Vivado-3924-DESKTOP-1M6FA7L/realtime/DCM_100MHz_10MHz_stub.vhdl:5' bound to instance 'reloj' of component 'DCM_100MHz_10MHz' [C:/hlocal/ExamenPasado4/ficheros/MIPSMulticiclo.vhd:89]
INFO: [Synth 8-638] synthesizing module 'DCM_100MHz_10MHz' [C:/hlocal/ExamenPasado4/MIPSMulticiclo_R3yModoDepuracion.runs/synth_1/.Xil/Vivado-3924-DESKTOP-1M6FA7L/realtime/DCM_100MHz_10MHz_stub.vhdl:13]
	Parameter FREQ bound to: 10000 - type: integer 
	Parameter BOUNCE bound to: 100 - type: integer 
INFO: [Synth 8-3491] module 'debouncer' declared at 'C:/hlocal/ExamenPasado4/ficheros/debouncer.vhd:5' bound to instance 'eliminadorRebotesModo' of component 'debouncer' [C:/hlocal/ExamenPasado4/ficheros/MIPSMulticiclo.vhd:91]
INFO: [Synth 8-638] synthesizing module 'debouncer' [C:/hlocal/ExamenPasado4/ficheros/debouncer.vhd:20]
	Parameter FREQ bound to: 10000 - type: integer 
	Parameter BOUNCE bound to: 100 - type: integer 
INFO: [Synth 8-256] done synthesizing module 'debouncer' (1#1) [C:/hlocal/ExamenPasado4/ficheros/debouncer.vhd:20]
INFO: [Synth 8-3491] module 'unidadDeControl' declared at 'C:/hlocal/ExamenPasado4/ficheros/unidadDeControl.vhd:4' bound to instance 'UC' of component 'unidadDeControl' [C:/hlocal/ExamenPasado4/ficheros/MIPSMulticiclo.vhd:93]
INFO: [Synth 8-638] synthesizing module 'unidadDeControl' [C:/hlocal/ExamenPasado4/ficheros/unidadDeControl.vhd:16]
INFO: [Synth 8-256] done synthesizing module 'unidadDeControl' (2#1) [C:/hlocal/ExamenPasado4/ficheros/unidadDeControl.vhd:16]
INFO: [Synth 8-3491] module 'rutaDeDatos' declared at 'C:/hlocal/ExamenPasado4/ficheros/rutaDeDatos.vhd:4' bound to instance 'RD' of component 'rutaDeDatos' [C:/hlocal/ExamenPasado4/ficheros/MIPSMulticiclo.vhd:95]
INFO: [Synth 8-638] synthesizing module 'rutaDeDatos' [C:/hlocal/ExamenPasado4/ficheros/rutaDeDatos.vhd:18]
	Parameter bits_entradas bound to: 32 - type: integer 
INFO: [Synth 8-3491] module 'multiplexor2a1' declared at 'C:/hlocal/ExamenPasado4/ficheros/multiplexor2a1.vhd:4' bound to instance 'mux_PC' of component 'multiplexor2a1' [C:/hlocal/ExamenPasado4/ficheros/rutaDeDatos.vhd:161]
INFO: [Synth 8-638] synthesizing module 'multiplexor2a1' [C:/hlocal/ExamenPasado4/ficheros/multiplexor2a1.vhd:16]
	Parameter bits_entradas bound to: 32 - type: integer 
INFO: [Synth 8-256] done synthesizing module 'multiplexor2a1' (3#1) [C:/hlocal/ExamenPasado4/ficheros/multiplexor2a1.vhd:16]
	Parameter n bound to: 32 - type: integer 
INFO: [Synth 8-3491] module 'registro' declared at 'C:/hlocal/ExamenPasado4/ficheros/registro.vhd:4' bound to instance 'reg_PC' of component 'registro' [C:/hlocal/ExamenPasado4/ficheros/rutaDeDatos.vhd:163]
INFO: [Synth 8-638] synthesizing module 'registro' [C:/hlocal/ExamenPasado4/ficheros/registro.vhd:17]
	Parameter n bound to: 32 - type: integer 
INFO: [Synth 8-256] done synthesizing module 'registro' (4#1) [C:/hlocal/ExamenPasado4/ficheros/registro.vhd:17]
	Parameter bits_entradas bound to: 32 - type: integer 
INFO: [Synth 8-3491] module 'multiplexor2a1' declared at 'C:/hlocal/ExamenPasado4/ficheros/multiplexor2a1.vhd:4' bound to instance 'mux_IorD' of component 'multiplexor2a1' [C:/hlocal/ExamenPasado4/ficheros/rutaDeDatos.vhd:165]
INFO: [Synth 8-3491] module 'memoria' declared at 'C:/hlocal/ExamenPasado4/ficheros/memoria.vhd:4' bound to instance 'mem' of component 'memoria' [C:/hlocal/ExamenPasado4/ficheros/rutaDeDatos.vhd:167]
INFO: [Synth 8-638] synthesizing module 'memoria' [C:/hlocal/ExamenPasado4/ficheros/memoria.vhd:15]
INFO: [Synth 8-3491] module 'mem32x512' declared at 'C:/hlocal/ExamenPasado4/MIPSMulticiclo_R3yModoDepuracion.runs/synth_1/.Xil/Vivado-3924-DESKTOP-1M6FA7L/realtime/mem32x512_stub.vhdl:5' bound to instance 'mem' of component 'mem32x512' [C:/hlocal/ExamenPasado4/ficheros/memoria.vhd:44]
INFO: [Synth 8-638] synthesizing module 'mem32x512' [C:/hlocal/ExamenPasado4/MIPSMulticiclo_R3yModoDepuracion.runs/synth_1/.Xil/Vivado-3924-DESKTOP-1M6FA7L/realtime/mem32x512_stub.vhdl:17]
INFO: [Synth 8-256] done synthesizing module 'memoria' (5#1) [C:/hlocal/ExamenPasado4/ficheros/memoria.vhd:15]
	Parameter n bound to: 32 - type: integer 
INFO: [Synth 8-3491] module 'registro' declared at 'C:/hlocal/ExamenPasado4/ficheros/registro.vhd:4' bound to instance 'reg_IR' of component 'registro' [C:/hlocal/ExamenPasado4/ficheros/rutaDeDatos.vhd:169]
	Parameter bits_entradas bound to: 5 - type: integer 
INFO: [Synth 8-3491] module 'multiplexor2a1' declared at 'C:/hlocal/ExamenPasado4/ficheros/multiplexor2a1.vhd:4' bound to instance 'mux_RW' of component 'multiplexor2a1' [C:/hlocal/ExamenPasado4/ficheros/rutaDeDatos.vhd:171]
INFO: [Synth 8-638] synthesizing module 'multiplexor2a1__parameterized2' [C:/hlocal/ExamenPasado4/ficheros/multiplexor2a1.vhd:16]
	Parameter bits_entradas bound to: 5 - type: integer 
INFO: [Synth 8-256] done synthesizing module 'multiplexor2a1__parameterized2' (5#1) [C:/hlocal/ExamenPasado4/ficheros/multiplexor2a1.vhd:16]
	Parameter bits_entradas bound to: 32 - type: integer 
INFO: [Synth 8-3491] module 'multiplexor8a1' declared at 'C:/hlocal/ExamenPasado4/MIPSMulticiclo_R3yModoDepuracion.srcs/sources_1/new/multiplexor8a1.vhd:34' bound to instance 'mux_MDR' of component 'multiplexor8a1' [C:/hlocal/ExamenPasado4/ficheros/rutaDeDatos.vhd:173]
INFO: [Synth 8-638] synthesizing module 'multiplexor8a1' [C:/hlocal/ExamenPasado4/MIPSMulticiclo_R3yModoDepuracion.srcs/sources_1/new/multiplexor8a1.vhd:52]
	Parameter bits_entradas bound to: 32 - type: integer 
INFO: [Synth 8-256] done synthesizing module 'multiplexor8a1' (6#1) [C:/hlocal/ExamenPasado4/MIPSMulticiclo_R3yModoDepuracion.srcs/sources_1/new/multiplexor8a1.vhd:52]
INFO: [Synth 8-3491] module 'bancoDeRegistros' declared at 'C:/hlocal/ExamenPasado4/ficheros/bancoDeRegistros.vhd:5' bound to instance 'banco_registros' of component 'bancoDeRegistros' [C:/hlocal/ExamenPasado4/ficheros/rutaDeDatos.vhd:194]
INFO: [Synth 8-638] synthesizing module 'bancoDeRegistros' [C:/hlocal/ExamenPasado4/ficheros/bancoDeRegistros.vhd:20]
INFO: [Synth 8-256] done synthesizing module 'bancoDeRegistros' (7#1) [C:/hlocal/ExamenPasado4/ficheros/bancoDeRegistros.vhd:20]
	Parameter n bound to: 32 - type: integer 
INFO: [Synth 8-3491] module 'registro' declared at 'C:/hlocal/ExamenPasado4/ficheros/registro.vhd:4' bound to instance 'reg_A' of component 'registro' [C:/hlocal/ExamenPasado4/ficheros/rutaDeDatos.vhd:196]
	Parameter n bound to: 32 - type: integer 
INFO: [Synth 8-3491] module 'registro' declared at 'C:/hlocal/ExamenPasado4/ficheros/registro.vhd:4' bound to instance 'reg_B' of component 'registro' [C:/hlocal/ExamenPasado4/ficheros/rutaDeDatos.vhd:198]
	Parameter bits_entradas bound to: 32 - type: integer 
INFO: [Synth 8-3491] module 'multiplexor2a1' declared at 'C:/hlocal/ExamenPasado4/ficheros/multiplexor2a1.vhd:4' bound to instance 'mux_opA' of component 'multiplexor2a1' [C:/hlocal/ExamenPasado4/ficheros/rutaDeDatos.vhd:200]
	Parameter bits_entradas bound to: 32 - type: integer 
INFO: [Synth 8-3491] module 'multiplexor4a1' declared at 'C:/hlocal/ExamenPasado4/ficheros/multiplexor4a1.vhd:4' bound to instance 'mux_opB' of component 'multiplexor4a1' [C:/hlocal/ExamenPasado4/ficheros/rutaDeDatos.vhd:202]
INFO: [Synth 8-638] synthesizing module 'multiplexor4a1' [C:/hlocal/ExamenPasado4/ficheros/multiplexor4a1.vhd:18]
	Parameter bits_entradas bound to: 32 - type: integer 
INFO: [Synth 8-256] done synthesizing module 'multiplexor4a1' (8#1) [C:/hlocal/ExamenPasado4/ficheros/multiplexor4a1.vhd:18]
INFO: [Synth 8-3491] module 'ALU' declared at 'C:/hlocal/ExamenPasado4/ficheros/ALU.vhd:5' bound to instance 'ALU_i' of component 'ALU' [C:/hlocal/ExamenPasado4/ficheros/rutaDeDatos.vhd:204]
INFO: [Synth 8-638] synthesizing module 'ALU' [C:/hlocal/ExamenPasado4/ficheros/ALU.vhd:16]
INFO: [Synth 8-256] done synthesizing module 'ALU' (9#1) [C:/hlocal/ExamenPasado4/ficheros/ALU.vhd:16]
	Parameter n bound to: 32 - type: integer 
INFO: [Synth 8-3491] module 'registro' declared at 'C:/hlocal/ExamenPasado4/ficheros/registro.vhd:4' bound to instance 'reg_ALUout' of component 'registro' [C:/hlocal/ExamenPasado4/ficheros/rutaDeDatos.vhd:206]
	Parameter n bound to: 32 - type: integer 
INFO: [Synth 8-3491] module 'registro' declared at 'C:/hlocal/ExamenPasado4/ficheros/registro.vhd:4' bound to instance 'regLeds' of component 'registro' [C:/hlocal/ExamenPasado4/ficheros/rutaDeDatos.vhd:208]
INFO: [Synth 8-256] done synthesizing module 'rutaDeDatos' (10#1) [C:/hlocal/ExamenPasado4/ficheros/rutaDeDatos.vhd:18]
INFO: [Synth 8-3491] module 'displays' declared at 'C:/hlocal/ExamenPasado4/ficheros/displays.vhd:7' bound to instance 'displays_i' of component 'displays' [C:/hlocal/ExamenPasado4/ficheros/MIPSMulticiclo.vhd:97]
INFO: [Synth 8-638] synthesizing module 'displays' [C:/hlocal/ExamenPasado4/ficheros/displays.vhd:20]
INFO: [Synth 8-3491] module 'conv_7seg' declared at 'C:/hlocal/ExamenPasado4/ficheros/conv_7seg.vhd:4' bound to instance 'conv_7seg_digito_0' of component 'conv_7seg' [C:/hlocal/ExamenPasado4/ficheros/displays.vhd:36]
INFO: [Synth 8-638] synthesizing module 'conv_7seg' [C:/hlocal/ExamenPasado4/ficheros/conv_7seg.vhd:9]
INFO: [Synth 8-256] done synthesizing module 'conv_7seg' (11#1) [C:/hlocal/ExamenPasado4/ficheros/conv_7seg.vhd:9]
INFO: [Synth 8-3491] module 'conv_7seg' declared at 'C:/hlocal/ExamenPasado4/ficheros/conv_7seg.vhd:4' bound to instance 'conv_7seg_digito_1' of component 'conv_7seg' [C:/hlocal/ExamenPasado4/ficheros/displays.vhd:37]
INFO: [Synth 8-3491] module 'conv_7seg' declared at 'C:/hlocal/ExamenPasado4/ficheros/conv_7seg.vhd:4' bound to instance 'conv_7seg_digito_2' of component 'conv_7seg' [C:/hlocal/ExamenPasado4/ficheros/displays.vhd:38]
INFO: [Synth 8-3491] module 'conv_7seg' declared at 'C:/hlocal/ExamenPasado4/ficheros/conv_7seg.vhd:4' bound to instance 'conv_7seg_digito_3' of component 'conv_7seg' [C:/hlocal/ExamenPasado4/ficheros/displays.vhd:39]
INFO: [Synth 8-256] done synthesizing module 'displays' (12#1) [C:/hlocal/ExamenPasado4/ficheros/displays.vhd:20]
INFO: [Synth 8-256] done synthesizing module 'MIPSMulticiclo' (13#1) [C:/hlocal/ExamenPasado4/ficheros/MIPSMulticiclo.vhd:18]
WARNING: [Synth 8-3331] design memoria has unconnected port ADDR[31]
WARNING: [Synth 8-3331] design memoria has unconnected port ADDR[30]
WARNING: [Synth 8-3331] design memoria has unconnected port ADDR[29]
WARNING: [Synth 8-3331] design memoria has unconnected port ADDR[28]
WARNING: [Synth 8-3331] design memoria has unconnected port ADDR[27]
WARNING: [Synth 8-3331] design memoria has unconnected port ADDR[26]
WARNING: [Synth 8-3331] design memoria has unconnected port ADDR[25]
WARNING: [Synth 8-3331] design memoria has unconnected port ADDR[24]
WARNING: [Synth 8-3331] design memoria has unconnected port ADDR[23]
WARNING: [Synth 8-3331] design memoria has unconnected port ADDR[22]
WARNING: [Synth 8-3331] design memoria has unconnected port ADDR[21]
WARNING: [Synth 8-3331] design memoria has unconnected port ADDR[20]
WARNING: [Synth 8-3331] design memoria has unconnected port ADDR[19]
WARNING: [Synth 8-3331] design memoria has unconnected port ADDR[18]
WARNING: [Synth 8-3331] design memoria has unconnected port ADDR[17]
WARNING: [Synth 8-3331] design memoria has unconnected port ADDR[16]
WARNING: [Synth 8-3331] design memoria has unconnected port ADDR[15]
WARNING: [Synth 8-3331] design memoria has unconnected port ADDR[14]
WARNING: [Synth 8-3331] design memoria has unconnected port ADDR[13]
WARNING: [Synth 8-3331] design memoria has unconnected port ADDR[12]
WARNING: [Synth 8-3331] design memoria has unconnected port ADDR[11]
WARNING: [Synth 8-3331] design memoria has unconnected port ADDR[1]
WARNING: [Synth 8-3331] design memoria has unconnected port ADDR[0]
---------------------------------------------------------------------------------
Finished RTL Elaboration : Time (s): cpu = 00:00:07 ; elapsed = 00:00:07 . Memory (MB): peak = 889.465 ; gain = 244.090
---------------------------------------------------------------------------------

Report Check Netlist: 
+------+------------------+-------+---------+-------+------------------+
|      |Item              |Errors |Warnings |Status |Description       |
+------+------------------+-------+---------+-------+------------------+
|1     |multi_driven_nets |      0|        0|Passed |Multi driven nets |
+------+------------------+-------+---------+-------+------------------+
---------------------------------------------------------------------------------
Start Handling Custom Attributes
---------------------------------------------------------------------------------
---------------------------------------------------------------------------------
Finished Handling Custom Attributes : Time (s): cpu = 00:00:07 ; elapsed = 00:00:08 . Memory (MB): peak = 889.465 ; gain = 244.090
---------------------------------------------------------------------------------
---------------------------------------------------------------------------------
Finished RTL Optimization Phase 1 : Time (s): cpu = 00:00:07 ; elapsed = 00:00:08 . Memory (MB): peak = 889.465 ; gain = 244.090
---------------------------------------------------------------------------------
INFO: [Project 1-570] Preparing netlist for logic optimization

Processing XDC Constraints
Initializing timing engine
Parsing XDC File [c:/hlocal/ExamenPasado4/MIPSMulticiclo_R3yModoDepuracion.srcs/sources_1/ip/mem32x512/mem32x512/mem32x512_in_context.xdc] for cell 'RD/mem/mem'
Finished Parsing XDC File [c:/hlocal/ExamenPasado4/MIPSMulticiclo_R3yModoDepuracion.srcs/sources_1/ip/mem32x512/mem32x512/mem32x512_in_context.xdc] for cell 'RD/mem/mem'
Parsing XDC File [c:/hlocal/ExamenPasado4/MIPSMulticiclo_R3yModoDepuracion.srcs/sources_1/ip/DCM_100MHz_10MHz/DCM_100MHz_10MHz/DCM_100MHz_10MHz_in_context.xdc] for cell 'reloj'
Finished Parsing XDC File [c:/hlocal/ExamenPasado4/MIPSMulticiclo_R3yModoDepuracion.srcs/sources_1/ip/DCM_100MHz_10MHz/DCM_100MHz_10MHz/DCM_100MHz_10MHz_in_context.xdc] for cell 'reloj'
Parsing XDC File [C:/hlocal/ExamenPasado4/ficheros/Basys3_Master.xdc]
Finished Parsing XDC File [C:/hlocal/ExamenPasado4/ficheros/Basys3_Master.xdc]
INFO: [Project 1-236] Implementation specific constraints were found while reading constraint file [C:/hlocal/ExamenPasado4/ficheros/Basys3_Master.xdc]. These constraints will be ignored for synthesis but will be used in implementation. Impacted constraints are listed in the file [.Xil/MIPSMulticiclo_propImpl.xdc].
Resolution: To avoid this warning, move constraints listed in [.Xil/MIPSMulticiclo_propImpl.xdc] to another XDC file and exclude this new file from synthesis with the used_in_synthesis property (File Properties dialog in GUI) and re-run elaboration/synthesis.
Parsing XDC File [C:/hlocal/ExamenPasado4/MIPSMulticiclo_R3yModoDepuracion.runs/synth_1/dont_touch.xdc]
Finished Parsing XDC File [C:/hlocal/ExamenPasado4/MIPSMulticiclo_R3yModoDepuracion.runs/synth_1/dont_touch.xdc]
Completed Processing XDC Constraints

Netlist sorting complete. Time (s): cpu = 00:00:00 ; elapsed = 00:00:00.001 . Memory (MB): peak = 1021.184 ; gain = 0.000
INFO: [Project 1-111] Unisim Transformation Summary:
No Unisim elements were transformed.

Constraint Validation Runtime : Time (s): cpu = 00:00:00 ; elapsed = 00:00:00.017 . Memory (MB): peak = 1021.184 ; gain = 0.000
---------------------------------------------------------------------------------
Finished Constraint Validation : Time (s): cpu = 00:00:16 ; elapsed = 00:00:17 . Memory (MB): peak = 1021.184 ; gain = 375.809
---------------------------------------------------------------------------------
---------------------------------------------------------------------------------
Start Loading Part and Timing Information
---------------------------------------------------------------------------------
Loading part: xc7a35tcpg236-1
---------------------------------------------------------------------------------
Finished Loading Part and Timing Information : Time (s): cpu = 00:00:16 ; elapsed = 00:00:17 . Memory (MB): peak = 1021.184 ; gain = 375.809
---------------------------------------------------------------------------------
---------------------------------------------------------------------------------
Start Applying 'set_property' XDC Constraints
---------------------------------------------------------------------------------
Applied set_property IO_BUFFER_TYPE = NONE for clk. (constraint file  c:/hlocal/ExamenPasado4/MIPSMulticiclo_R3yModoDepuracion.srcs/sources_1/ip/DCM_100MHz_10MHz/DCM_100MHz_10MHz/DCM_100MHz_10MHz_in_context.xdc, line 3).
Applied set_property CLOCK_BUFFER_TYPE = NONE for clk. (constraint file  c:/hlocal/ExamenPasado4/MIPSMulticiclo_R3yModoDepuracion.srcs/sources_1/ip/DCM_100MHz_10MHz/DCM_100MHz_10MHz/DCM_100MHz_10MHz_in_context.xdc, line 4).
Applied set_property DONT_TOUCH = true for RD/mem/mem. (constraint file  auto generated constraint, line ).
Applied set_property DONT_TOUCH = true for reloj. (constraint file  auto generated constraint, line ).
---------------------------------------------------------------------------------
Finished applying 'set_property' XDC Constraints : Time (s): cpu = 00:00:16 ; elapsed = 00:00:17 . Memory (MB): peak = 1021.184 ; gain = 375.809
---------------------------------------------------------------------------------
INFO: [Synth 8-802] inferred FSM for state register 'state_reg' in module 'debouncer'
INFO: [Synth 8-802] inferred FSM for state register 'currentState_reg' in module 'unidadDeControl'
---------------------------------------------------------------------------------------------------
                   State |                     New Encoding |                Previous Encoding 
---------------------------------------------------------------------------------------------------
         waitingpression |                               00 |                               00
      pressiondebouncing |                               01 |                               01
       waitingdepression |                               10 |                               10
    depressiondebouncing |                               11 |                               11
---------------------------------------------------------------------------------------------------
INFO: [Synth 8-3354] encoded FSM with state register 'state_reg' using encoding 'sequential' in module 'debouncer'
---------------------------------------------------------------------------------------------------
                   State |                     New Encoding |                Previous Encoding 
---------------------------------------------------------------------------------------------------
                      s0 |                00000000000000001 |                            00000
                      s1 |                00000000000000010 |                            00001
                      s2 |                00000000000000100 |                            00010
                      s8 |                00000000000001000 |                            01000
                      s9 |                00000000000010000 |                            01001
                      s3 |                00000000000100000 |                            00011
                      s4 |                00000000001000000 |                            00100
                      s5 |                00000000010000000 |                            00101
                      s6 |                00000000100000000 |                            00110
                      s7 |                00000001000000000 |                            00111
                     s10 |                00000010000000000 |                            01010
                     s11 |                00000100000000000 |                            01011
                     s12 |                00001000000000000 |                            01100
                     s13 |                00010000000000000 |                            01101
                     s14 |                00100000000000000 |                            01110
                     s15 |                01000000000000000 |                            01111
                     s16 |                10000000000000000 |                            10000
---------------------------------------------------------------------------------------------------
INFO: [Synth 8-3354] encoded FSM with state register 'currentState_reg' using encoding 'one-hot' in module 'unidadDeControl'
---------------------------------------------------------------------------------
Finished RTL Optimization Phase 2 : Time (s): cpu = 00:00:17 ; elapsed = 00:00:18 . Memory (MB): peak = 1021.184 ; gain = 375.809
---------------------------------------------------------------------------------

Report RTL Partitions: 
+-+--------------+------------+----------+
| |RTL Partition |Replication |Instances |
+-+--------------+------------+----------+
+-+--------------+------------+----------+
---------------------------------------------------------------------------------
Start RTL Component Statistics 
---------------------------------------------------------------------------------
Detailed RTL Component Info : 
+---Adders : 
	   3 Input     32 Bit       Adders := 1     
	   2 Input     32 Bit       Adders := 1     
+---XORs : 
	   2 Input     32 Bit         XORs := 1     
+---Registers : 
	               32 Bit    Registers := 38    
	                1 Bit    Registers := 2     
+---Muxes : 
	   2 Input     32 Bit        Muxes := 5     
	   4 Input     32 Bit        Muxes := 1     
	   6 Input     32 Bit        Muxes := 1     
	  17 Input     20 Bit        Muxes := 1     
	  17 Input     17 Bit        Muxes := 1     
	   9 Input     17 Bit        Muxes := 1     
	   2 Input     17 Bit        Muxes := 1     
	   4 Input      7 Bit        Muxes := 1     
	   2 Input      5 Bit        Muxes := 1     
	   2 Input      4 Bit        Muxes := 1     
	   4 Input      4 Bit        Muxes := 1     
	   6 Input      3 Bit        Muxes := 1     
	   4 Input      2 Bit        Muxes := 1     
	   2 Input      2 Bit        Muxes := 1     
	   2 Input      1 Bit        Muxes := 33    
	   4 Input      1 Bit        Muxes := 5     
	  10 Input      1 Bit        Muxes := 1     
	  17 Input      1 Bit        Muxes := 1     
---------------------------------------------------------------------------------
Finished RTL Component Statistics 
---------------------------------------------------------------------------------
---------------------------------------------------------------------------------
Start RTL Hierarchical Component Statistics 
---------------------------------------------------------------------------------
Hierarchical RTL Component report 
Module debouncer 
Detailed RTL Component Info : 
+---Registers : 
	                1 Bit    Registers := 2     
+---Muxes : 
	   4 Input      2 Bit        Muxes := 1     
	   2 Input      2 Bit        Muxes := 1     
	   2 Input      1 Bit        Muxes := 1     
	   4 Input      1 Bit        Muxes := 5     
Module unidadDeControl 
Detailed RTL Component Info : 
+---Muxes : 
	  17 Input     20 Bit        Muxes := 1     
	  17 Input     17 Bit        Muxes := 1     
	   9 Input     17 Bit        Muxes := 1     
	   2 Input     17 Bit        Muxes := 1     
	  10 Input      1 Bit        Muxes := 1     
	  17 Input      1 Bit        Muxes := 1     
Module multiplexor2a1 
Detailed RTL Component Info : 
+---Muxes : 
	   2 Input     32 Bit        Muxes := 1     
Module registro 
Detailed RTL Component Info : 
+---Registers : 
	               32 Bit    Registers := 1     
Module multiplexor2a1__parameterized2 
Detailed RTL Component Info : 
+---Muxes : 
	   2 Input      5 Bit        Muxes := 1     
Module bancoDeRegistros 
Detailed RTL Component Info : 
+---Registers : 
	               32 Bit    Registers := 32    
+---Muxes : 
	   2 Input      1 Bit        Muxes := 32    
Module multiplexor4a1 
Detailed RTL Component Info : 
+---Muxes : 
	   4 Input     32 Bit        Muxes := 1     
Module ALU 
Detailed RTL Component Info : 
+---Adders : 
	   3 Input     32 Bit       Adders := 1     
	   2 Input     32 Bit       Adders := 1     
+---XORs : 
	   2 Input     32 Bit         XORs := 1     
+---Muxes : 
	   6 Input     32 Bit        Muxes := 1     
	   2 Input     32 Bit        Muxes := 2     
	   6 Input      3 Bit        Muxes := 1     
Module rutaDeDatos 
Detailed RTL Component Info : 
+---Muxes : 
	   2 Input      4 Bit        Muxes := 1     
Module displays 
Detailed RTL Component Info : 
+---Muxes : 
	   4 Input      7 Bit        Muxes := 1     
	   4 Input      4 Bit        Muxes := 1     
---------------------------------------------------------------------------------
Finished RTL Hierarchical Component Statistics
---------------------------------------------------------------------------------
---------------------------------------------------------------------------------
Start Part Resource Summary
---------------------------------------------------------------------------------
Part Resources:
DSPs: 90 (col length:60)
BRAMs: 100 (col length: RAMB18 60 RAMB36 30)
---------------------------------------------------------------------------------
Finished Part Resource Summary
---------------------------------------------------------------------------------
---------------------------------------------------------------------------------
Start Cross Boundary and Area Optimization
---------------------------------------------------------------------------------
Warning: Parallel synthesis criteria is not met 
INFO: [Synth 8-5546] ROM "UC/" won't be mapped to RAM because it is too sparse
---------------------------------------------------------------------------------
Finished Cross Boundary and Area Optimization : Time (s): cpu = 00:00:26 ; elapsed = 00:00:27 . Memory (MB): peak = 1021.184 ; gain = 375.809
---------------------------------------------------------------------------------

Report RTL Partitions: 
+-+--------------+------------+----------+
| |RTL Partition |Replication |Instances |
+-+--------------+------------+----------+
+-+--------------+------------+----------+
---------------------------------------------------------------------------------
Start Applying XDC Timing Constraints
---------------------------------------------------------------------------------
INFO: [Synth 8-5578] Moved timing constraint from pin 'reloj/clk_out1' to pin 'reloj/bbstub_clk_out1/O'
INFO: [Synth 8-5819] Moved 1 constraints on hierarchical pins to their respective driving/loading pins
---------------------------------------------------------------------------------
Finished Applying XDC Timing Constraints : Time (s): cpu = 00:00:38 ; elapsed = 00:00:39 . Memory (MB): peak = 1021.184 ; gain = 375.809
---------------------------------------------------------------------------------
---------------------------------------------------------------------------------
Start Timing Optimization
---------------------------------------------------------------------------------
---------------------------------------------------------------------------------
Finished Timing Optimization : Time (s): cpu = 00:00:49 ; elapsed = 00:00:50 . Memory (MB): peak = 1156.840 ; gain = 511.465
---------------------------------------------------------------------------------

Report RTL Partitions: 
+-+--------------+------------+----------+
| |RTL Partition |Replication |Instances |
+-+--------------+------------+----------+
+-+--------------+------------+----------+
---------------------------------------------------------------------------------
Start Technology Mapping
---------------------------------------------------------------------------------
---------------------------------------------------------------------------------
Finished Technology Mapping : Time (s): cpu = 00:00:50 ; elapsed = 00:00:51 . Memory (MB): peak = 1157.879 ; gain = 512.504
---------------------------------------------------------------------------------

Report RTL Partitions: 
+-+--------------+------------+----------+
| |RTL Partition |Replication |Instances |
+-+--------------+------------+----------+
+-+--------------+------------+----------+
---------------------------------------------------------------------------------
Start IO Insertion
---------------------------------------------------------------------------------
---------------------------------------------------------------------------------
Start Flattening Before IO Insertion
---------------------------------------------------------------------------------
---------------------------------------------------------------------------------
Finished Flattening Before IO Insertion
---------------------------------------------------------------------------------
---------------------------------------------------------------------------------
Start Final Netlist Cleanup
---------------------------------------------------------------------------------
---------------------------------------------------------------------------------
Finished Final Netlist Cleanup
---------------------------------------------------------------------------------
---------------------------------------------------------------------------------
Finished IO Insertion : Time (s): cpu = 00:00:53 ; elapsed = 00:00:55 . Memory (MB): peak = 1157.879 ; gain = 512.504
---------------------------------------------------------------------------------

Report Check Netlist: 
+------+------------------+-------+---------+-------+------------------+
|      |Item              |Errors |Warnings |Status |Description       |
+------+------------------+-------+---------+-------+------------------+
|1     |multi_driven_nets |      0|        0|Passed |Multi driven nets |
+------+------------------+-------+---------+-------+------------------+
---------------------------------------------------------------------------------
Start Renaming Generated Instances
---------------------------------------------------------------------------------
---------------------------------------------------------------------------------
Finished Renaming Generated Instances : Time (s): cpu = 00:00:54 ; elapsed = 00:00:55 . Memory (MB): peak = 1157.879 ; gain = 512.504
---------------------------------------------------------------------------------

Report RTL Partitions: 
+-+--------------+------------+----------+
| |RTL Partition |Replication |Instances |
+-+--------------+------------+----------+
+-+--------------+------------+----------+
---------------------------------------------------------------------------------
Start Rebuilding User Hierarchy
---------------------------------------------------------------------------------
---------------------------------------------------------------------------------
Finished Rebuilding User Hierarchy : Time (s): cpu = 00:00:54 ; elapsed = 00:00:55 . Memory (MB): peak = 1157.879 ; gain = 512.504
---------------------------------------------------------------------------------
---------------------------------------------------------------------------------
Start Renaming Generated Ports
---------------------------------------------------------------------------------
---------------------------------------------------------------------------------
Finished Renaming Generated Ports : Time (s): cpu = 00:00:54 ; elapsed = 00:00:55 . Memory (MB): peak = 1157.879 ; gain = 512.504
---------------------------------------------------------------------------------
---------------------------------------------------------------------------------
Start Handling Custom Attributes
---------------------------------------------------------------------------------
---------------------------------------------------------------------------------
Finished Handling Custom Attributes : Time (s): cpu = 00:00:54 ; elapsed = 00:00:55 . Memory (MB): peak = 1157.879 ; gain = 512.504
---------------------------------------------------------------------------------
---------------------------------------------------------------------------------
Start Renaming Generated Nets
---------------------------------------------------------------------------------
---------------------------------------------------------------------------------
Finished Renaming Generated Nets : Time (s): cpu = 00:00:54 ; elapsed = 00:00:55 . Memory (MB): peak = 1157.879 ; gain = 512.504
---------------------------------------------------------------------------------
---------------------------------------------------------------------------------
Start Writing Synthesis Report
---------------------------------------------------------------------------------

Report BlackBoxes: 
+------+-----------------+----------+
|      |BlackBox name    |Instances |
+------+-----------------+----------+
|1     |DCM_100MHz_10MHz |         1|
|2     |mem32x512        |         1|
+------+-----------------+----------+

Report Cell Usage: 
+------+------------------------+------+
|      |Cell                    |Count |
+------+------------------------+------+
|1     |DCM_100MHz_10MHz_bbox_0 |     1|
|2     |mem32x512_bbox_1        |     1|
|3     |CARRY4                  |    27|
|4     |LUT1                    |     1|
|5     |LUT2                    |    21|
|6     |LUT3                    |    80|
|7     |LUT4                    |    74|
|8     |LUT5                    |   103|
|9     |LUT6                    |   818|
|10    |MUXF7                   |   288|
|11    |FDCE                    |  1239|
|12    |FDPE                    |     3|
|13    |FDRE                    |    20|
|14    |IBUF                    |    11|
|15    |OBUF                    |    19|
+------+------------------------+------+

Report Instance Areas: 
+------+------------------------+-----------------+------+
|      |Instance                |Module           |Cells |
+------+------------------------+-----------------+------+
|1     |top                     |                 |  2737|
|2     |  RD                    |rutaDeDatos      |  2428|
|3     |    ALU_i               |ALU              |   124|
|4     |    banco_registros     |bancoDeRegistros |  1871|
|5     |    mem                 |memoria          |    32|
|6     |    regLeds             |registro         |     8|
|7     |    reg_A               |registro_0       |    35|
|8     |    reg_ALUout          |registro_1       |    32|
|9     |    reg_B               |registro_2       |    32|
|10    |    reg_IR              |registro_3       |   242|
|11    |    reg_PC              |registro_4       |    52|
|12    |  UC                    |unidadDeControl  |   178|
|13    |  displays_i            |displays         |    31|
|14    |  eliminadorRebotesModo |debouncer        |    69|
+------+------------------------+-----------------+------+
---------------------------------------------------------------------------------
Finished Writing Synthesis Report : Time (s): cpu = 00:00:54 ; elapsed = 00:00:55 . Memory (MB): peak = 1157.879 ; gain = 512.504
---------------------------------------------------------------------------------
Synthesis finished with 0 errors, 0 critical warnings and 0 warnings.
Synthesis Optimization Runtime : Time (s): cpu = 00:00:43 ; elapsed = 00:00:51 . Memory (MB): peak = 1157.879 ; gain = 380.785
Synthesis Optimization Complete : Time (s): cpu = 00:00:54 ; elapsed = 00:00:55 . Memory (MB): peak = 1157.879 ; gain = 512.504
INFO: [Project 1-571] Translating synthesized netlist
INFO: [Netlist 29-17] Analyzing 315 Unisim elements for replacement
INFO: [Netlist 29-28] Unisim Transformation completed in 0 CPU seconds
INFO: [Project 1-570] Preparing netlist for logic optimization
INFO: [Opt 31-140] Inserted 1 IBUFs to IO ports without IO buffers.
INFO: [Opt 31-138] Pushed 0 inverter(s) to 0 load pin(s).
Netlist sorting complete. Time (s): cpu = 00:00:00 ; elapsed = 00:00:00.001 . Memory (MB): peak = 1157.879 ; gain = 0.000
INFO: [Project 1-111] Unisim Transformation Summary:
No Unisim elements were transformed.

INFO: [Common 17-83] Releasing license: Synthesis
75 Infos, 23 Warnings, 0 Critical Warnings and 0 Errors encountered.
synth_design completed successfully
synth_design: Time (s): cpu = 00:01:02 ; elapsed = 00:01:06 . Memory (MB): peak = 1157.879 ; gain = 751.559
Netlist sorting complete. Time (s): cpu = 00:00:00 ; elapsed = 00:00:00.001 . Memory (MB): peak = 1157.879 ; gain = 0.000
WARNING: [Constraints 18-5210] No constraints selected for write.
Resolution: This message can indicate that there are no constraints for the design, or it can indicate that the used_in flags are set such that the constraints are ignored. This later case is used when running synth_design to not write synthesis constraints to the resulting checkpoint. Instead, project constraints are read when the synthesized design is opened.
INFO: [Common 17-1381] The checkpoint 'C:/hlocal/ExamenPasado4/MIPSMulticiclo_R3yModoDepuracion.runs/synth_1/MIPSMulticiclo.dcp' has been generated.
INFO: [runtcl-4] Executing : report_utilization -file MIPSMulticiclo_utilization_synth.rpt -pb MIPSMulticiclo_utilization_synth.pb
INFO: [Common 17-206] Exiting Vivado at Sun Dec 15 15:37:05 2019...
